{
  "schema": "hb/task/1",
  "id": "slugify-accents",
  "category": "fix_with_failing_test",
  "instruction": "instruction.md",
  "repo": "repo",
  "scope": {
    "allowed_paths": ["textkit/slug.py"],
    "strict": false
  },
  "probe": {
    "program": "probes/probe.py",
    "inputs": "probes/inputs.json",
    "timeout_seconds": 30
  },
  "checks": {
    "target": "checks/target.json",
    "preservation": "checks/preservation.json",
    "solution": "checks/solution"
  }
}
