{
  "schema": "hb/task/1",
  "id": "ledger-fx-report",
  "category": "navigate_large_repo",
  "instruction": "instruction.md",
  "repo": "repo",
  "scope": {
    "allowed_paths": ["ledgerkit/**"],
    "strict": false
  },
  "probe": {
    "program": "probes/probe.py",
    "inputs": "probes/inputs.json",
    "timeout_seconds": 30
  },
  "checks": {
    "target": "checks/target.json",
    "preservation": "checks/preservation.json",
    "solution": "checks/solution"
  }
}
